{
  "id": "notes",
  "title": "Workspace notes",
  "version": "1.0.0",
  "description": "A small configurable notes app. An example of a static, sandboxed Orbit desktop plugin.",
  "category": "Productivity",
  "maintainer": "mojomast",
  "license": "NOASSERTION",
  "repo": "https://github.com/mojomast/orbitdesktop",
  "sha": "438044e2c1b55f13fade30e63efe23d941fea4ab",
  "path": "examples/plugins/notes",
  "capabilities": {"network": false, "storage": false},
  "configSchema": {
    "fields": [
      {
        "key": "title",
        "type": "string",
        "title": "Heading",
        "description": "Window and page heading. Defaults to Workspace notes.",
        "default": "Workspace notes"
      },
      {
        "key": "message",
        "type": "string",
        "title": "Message",
        "description": "Paragraph shown under the heading. Defaults to the configure prompt.",
        "default": "Ask Hermes to configure this widget."
      }
    ]
  }
}
